{
  "schema_version": "1.0.0",
  "generated_at": "2026-07-13T15:00:00Z",
  "items": [
    {
      "twin_id": "twin_signal_scout_001",
      "display_name": "Signal Scout - signoz to agent-testing",
      "decision_version": 1,
      "decision": "green",
      "risk": {"level": "low", "score": 18},
      "lifecycle_status": "green",
      "visible_lifecycle": "ready",
      "freshness": {
        "status": "fresh",
        "captured_at": "2026-07-13T14:52:00Z",
        "expires_at": "2026-07-13T16:52:00Z",
        "superseded_by": null,
        "message": "Evidence is fresh."
      },
      "target": {
        "cluster_id": "cluster_lab_01",
        "cluster_name": "BOS Genesis Lab",
        "namespace": "agent-testing"
      },
      "bundle": {
        "bundle_id": "mop_signal_scout_001",
        "bundle_hash": "aaaaaaaaaaaaaaaaaaaaaaaaaaaaaaaaaaaaaaaaaaaaaaaaaaaaaaaaaaaaaaaa",
        "release_version": "signoz-0.122.0",
        "open_href": "/activity?workflow=mop_generation&run_id=mop_signal_scout_001"
      },
      "created_by": "usr_admin",
      "created_by_display": "admin",
      "created_at": "2026-07-13T14:50:00Z",
      "updated_at": "2026-07-13T14:59:00Z",
      "relationships": {
        "approval_status": "not_required",
        "approval_id": null,
        "execution_status": "unlinked",
        "execution_id": null,
        "used_for_execution": false
      },
      "actions": [
        {
          "code": "open_twin",
          "label": "Open",
          "enabled": true,
          "visible": true,
          "method": "GET",
          "href": "/digital-twins/twin_signal_scout_001",
          "reason_code": "eligible",
          "disabled_reason": null,
          "requires_confirmation": false
        }
      ]
    }
  ],
  "page": {"limit": 25, "has_more": false, "next_cursor": null, "result_count": 1},
  "applied_query": {"sort": "created_at", "direction": "desc", "limit": 25}
}

